web-scraper-order,web-scraper-start-url,Category
"1550434567-285","https://organicfood.vn/gia-vi-va-phu-lieu?limit=100","Dầu quả bơ organic Clearspring"
"1550434567-338","https://organicfood.vn/gia-vi-va-phu-lieu?limit=100","Sốt tương ớt cà chua hữu cơ Salsa Jensens"
"1550434567-295","https://organicfood.vn/gia-vi-va-phu-lieu?limit=100","Hạt Nêm Hữu Cơ Naturgreen 200g"
"1550434567-346","https://organicfood.vn/gia-vi-va-phu-lieu?limit=100","Xốt Salad Caesar"
"1550434567-298","https://organicfood.vn/gia-vi-va-phu-lieu?limit=100","Mắm ruốc Bà Duệ"
"1550434567-321","https://organicfood.vn/gia-vi-va-phu-lieu?limit=100","Pate Chay Hạt Dẻ Tự Nhiên Granovita"
"1550434567-320","https://organicfood.vn/gia-vi-va-phu-lieu?limit=100","Nước Tương Tamari Ít Muối Hữu Cơ Global Organic 250ml"
"1550434567-328","https://organicfood.vn/gia-vi-va-phu-lieu?limit=100","Pho mát Mozzarella"
"1550434567-327","https://organicfood.vn/gia-vi-va-phu-lieu?limit=100","Pho mát Cheddar Sandwich"
"1550434567-291","https://organicfood.vn/gia-vi-va-phu-lieu?limit=100","Giấm Rượu Đỏ Hữu Cơ Global Organic"
"1550434567-310","https://organicfood.vn/gia-vi-va-phu-lieu?limit=100","Nước Dùng Rau Củ Hữu Cơ Australia's Own Hộp 1 Lít"
"1550434567-280","https://organicfood.vn/gia-vi-va-phu-lieu?limit=100","Dầu dừa nguyên chất Vietcoco - 500ml"
"1550434567-303","https://organicfood.vn/gia-vi-va-phu-lieu?limit=100","Muối hồng Himalaya Naturgreen"
"1550434567-269","https://organicfood.vn/gia-vi-va-phu-lieu?limit=100","Bơ Hữu Cơ Ghee"
"1550434567-309","https://organicfood.vn/gia-vi-va-phu-lieu?limit=100","Nước Dùng Gà Hữu Cơ Australia's Own Hộp 1 Lít"
"1550434567-350","https://organicfood.vn/gia-vi-va-phu-lieu?limit=100","Đường Phèn Nguyên Chất Anh Đăng 1Kg"
"1550434567-270","https://organicfood.vn/gia-vi-va-phu-lieu?limit=100","Bơ Lạt President"
"1550434567-268","https://organicfood.vn/gia-vi-va-phu-lieu?limit=100","Bắp ngọt hữu cơ đóng hộp Bio Idea 340g"
"1550434567-300","https://organicfood.vn/gia-vi-va-phu-lieu?limit=100","Mật mía hữu cơ Markal 430g"
"1550434567-314","https://organicfood.vn/gia-vi-va-phu-lieu?limit=100","Nước Sốt Salad Pháp Hữu Cơ Không Chứa Dầu, Gluten Ozganics"
"1550434567-283","https://organicfood.vn/gia-vi-va-phu-lieu?limit=100","Dầu Oliu Pomace Silarus Chiên 1L"
"1550434567-334","https://organicfood.vn/gia-vi-va-phu-lieu?limit=100","Sốt Ớt Chua Ngọt Hữu Cơ Naturata"
"1550434567-326","https://organicfood.vn/gia-vi-va-phu-lieu?limit=100","Pho mát Cheddar Hamburger"
"1550434567-296","https://organicfood.vn/gia-vi-va-phu-lieu?limit=100","Hoa Hồi Vipep 15g"
"1550434567-307","https://organicfood.vn/gia-vi-va-phu-lieu?limit=100","Nước Cốt Dừa Hữu Cơ Merito"
"1550434567-342","https://organicfood.vn/gia-vi-va-phu-lieu?limit=100","Tiêu Đen Hữu Cơ Farmer's Organic 50g"
"1550434567-319","https://organicfood.vn/gia-vi-va-phu-lieu?limit=100","Nước Tương Tamari Hữu Cơ Naturgreen 250ml"
"1550434567-323","https://organicfood.vn/gia-vi-va-phu-lieu?limit=100","Pate chay nấm hỗn hợp"
"1550434567-277","https://organicfood.vn/gia-vi-va-phu-lieu?limit=100","Bột Quế Vipep 35g"
"1550434567-317","https://organicfood.vn/gia-vi-va-phu-lieu?limit=100","Nước Tương Hữu Cơ Lum Lum"
"1550434567-275","https://organicfood.vn/gia-vi-va-phu-lieu?limit=100","Bột Nêm Rau Củ Bio Garten"
"1550434567-279","https://organicfood.vn/gia-vi-va-phu-lieu?limit=100","Dầu dừa nguyên chất Vietcoco - 250ml"
"1550434567-306","https://organicfood.vn/gia-vi-va-phu-lieu?limit=100","Muối Iot Cerebos"
"1550434567-289","https://organicfood.vn/gia-vi-va-phu-lieu?limit=100","Giấm rượu nâu Pháp"
"1550434567-315","https://organicfood.vn/gia-vi-va-phu-lieu?limit=100","Nước sốt Ý hữu cơ không chứa dầu, gluten Ozganics"
"1550434567-282","https://organicfood.vn/gia-vi-va-phu-lieu?limit=100","Dầu Oliu Nguyên Chất Italia"
"1550434567-290","https://organicfood.vn/gia-vi-va-phu-lieu?limit=100","Giấm rượu vang đỏ organic Clearspring"
"1550434567-313","https://organicfood.vn/gia-vi-va-phu-lieu?limit=100","Nước Sốt Mỳ Ý Hữu Cơ Jensens Hũ 700g"
"1550434567-281","https://organicfood.vn/gia-vi-va-phu-lieu?limit=100","Dầu Hạt Lanh Hữu Cơ Naturgreen"
"1550434567-276","https://organicfood.vn/gia-vi-va-phu-lieu?limit=100","Bột nêm rau củ hữu cơ Naturata"
"1550434567-302","https://organicfood.vn/gia-vi-va-phu-lieu?limit=100","Muối hồng Ecopink dạng hột"
"1550434567-339","https://organicfood.vn/gia-vi-va-phu-lieu?limit=100","Soup Miso Nhật ăn liền vị rong biển Clearspring"
"1550434567-273","https://organicfood.vn/gia-vi-va-phu-lieu?limit=100","Bột Gừng 80g"
"1550434567-274","https://organicfood.vn/gia-vi-va-phu-lieu?limit=100","Bột Năng Hữu Cơ Tapioca"
"1550434567-278","https://organicfood.vn/gia-vi-va-phu-lieu?limit=100","Cà chua nghiền hữu cơ Naturata"
"1550434567-316","https://organicfood.vn/gia-vi-va-phu-lieu?limit=100","Nước tương hữu cơ global organics"
"1550434567-297","https://organicfood.vn/gia-vi-va-phu-lieu?limit=100","Mắm Nêm Cao Cấp Bà Duệ"
"1550434567-318","https://organicfood.vn/gia-vi-va-phu-lieu?limit=100","Nước tương Sushi Sashimi Nhật Bản"
"1550434567-312","https://organicfood.vn/gia-vi-va-phu-lieu?limit=100","Nước Sốt Giấm Balsamic Không Chứa Dầu, Gluten Ozganics"
"1550434567-336","https://organicfood.vn/gia-vi-va-phu-lieu?limit=100","Sốt Tương Cà Ketchup Hữu Cơ Bio Idea"
"1550434567-343","https://organicfood.vn/gia-vi-va-phu-lieu?limit=100","Tiêu Đen Hữu Cơ Farmer's Organic 55g"
"1550434567-288","https://organicfood.vn/gia-vi-va-phu-lieu?limit=100","Gia Vị Nấu Sốt Cà Ri Xanh Hữu Cơ Lumlum 120gram"
"1550434567-347","https://organicfood.vn/gia-vi-va-phu-lieu?limit=100","Đường Củ Cải Hữu Cơ Naturata 500g"
"1550434567-294","https://organicfood.vn/gia-vi-va-phu-lieu?limit=100","Giấm Táo Đỏ Hàn Quốc"
"1550434567-308","https://organicfood.vn/gia-vi-va-phu-lieu?limit=100","Nước cốt dừa Organic đóng lon Vietcoco 400ml"
"1550434567-341","https://organicfood.vn/gia-vi-va-phu-lieu?limit=100","Tiêu Sọ Hữu Cơ Farmer's Organic 55g"
"1550434567-330","https://organicfood.vn/gia-vi-va-phu-lieu?limit=100","Siro Cây Thùa Agave Hữu Cơ"
"1550434567-284","https://organicfood.vn/gia-vi-va-phu-lieu?limit=100","Dầu olive extra virgin organic Clearspring"
"1550434567-292","https://organicfood.vn/gia-vi-va-phu-lieu?limit=100","Giấm táo hữu cơ Bragg - 473ml"
"1550434567-344","https://organicfood.vn/gia-vi-va-phu-lieu?limit=100","Tinh nghệ vàng hữu cơ Forny"
"1550434567-272","https://organicfood.vn/gia-vi-va-phu-lieu?limit=100","Bột cà ri hữu cơ (Ấn Độ)"
"1550434567-351","https://organicfood.vn/gia-vi-va-phu-lieu?limit=100","Đường Thnot Hữu Cơ (Hộp 500g)"
"1550434567-286","https://organicfood.vn/gia-vi-va-phu-lieu?limit=100","Gia Vị Hữu Cơ Nấu Tom Yum Lum Lum"
"1550434567-335","https://organicfood.vn/gia-vi-va-phu-lieu?limit=100","Sốt Ớt Sambal Oelek Hữu Cơ Lumlum"
"1550434567-329","https://organicfood.vn/gia-vi-va-phu-lieu?limit=100","Quế Cây Vipep"
"1550434567-333","https://organicfood.vn/gia-vi-va-phu-lieu?limit=100","Sốt Ớt Cay Hữu Cơ Naturata"
"1550434567-348","https://organicfood.vn/gia-vi-va-phu-lieu?limit=100","Đường mía thô hữu cơ Thái Lan"
"1550434567-325","https://organicfood.vn/gia-vi-va-phu-lieu?limit=100","Phô Mai Sợi Hữu Cơ Organic Valley 170g"
"1550434567-322","https://organicfood.vn/gia-vi-va-phu-lieu?limit=100","Pate chay nấm Champignon"
"1550434567-337","https://organicfood.vn/gia-vi-va-phu-lieu?limit=100","Sốt tương cà ketchup hữu cơ Bio Idea 480g"
"1550434567-331","https://organicfood.vn/gia-vi-va-phu-lieu?limit=100","Sốt Maiyonnaise Hữu Cơ Eden"
"1550434567-304","https://organicfood.vn/gia-vi-va-phu-lieu?limit=100","Muối hồng Himalaya Naturgreen dạng hột"
"1550434567-345","https://organicfood.vn/gia-vi-va-phu-lieu?limit=100","Xốt cà ri hữu cơ Lum Lum"
"1550434567-340","https://organicfood.vn/gia-vi-va-phu-lieu?limit=100","Tiêu Sọ Hữu Cơ Farmer's Organic 50g"
"1550434567-305","https://organicfood.vn/gia-vi-va-phu-lieu?limit=100","Muối hồng Himalayan Ecopink"
"1550434567-349","https://organicfood.vn/gia-vi-va-phu-lieu?limit=100","Đường Phèn Nguyên Chất Anh Đăng"
"1550434567-299","https://organicfood.vn/gia-vi-va-phu-lieu?limit=100","Mật cây thùa si rô agave hữu cơ Markal 330g"
"1550434567-324","https://organicfood.vn/gia-vi-va-phu-lieu?limit=100","Pate chay thảo mộc Krauter"
"1550434567-287","https://organicfood.vn/gia-vi-va-phu-lieu?limit=100","Gia Vị Nấu Sốt Cà Ri Vàng Hữu Cơ Lumlum 120gram"
"1550434567-271","https://organicfood.vn/gia-vi-va-phu-lieu?limit=100","Bơ Phết Hạnh Nhân Và Cacao NaturGreen 200g"
"1550434567-301","https://organicfood.vn/gia-vi-va-phu-lieu?limit=100","Muối Biển Coarse Crystals"
"1550434567-332","https://organicfood.vn/gia-vi-va-phu-lieu?limit=100","Sốt mayonnaise hữu cơ không có trứng Global Organics"
"1550434567-293","https://organicfood.vn/gia-vi-va-phu-lieu?limit=100","Giấm táo hữu cơ Kivinat 750ml"
"1550434567-311","https://organicfood.vn/gia-vi-va-phu-lieu?limit=100","Nước Sốt Caesar Hữu Cơ Gluten Ozganics 250ml"
